{
  "schema": "https://service-atoms.com/schemas/atom-v1.json",
  "type": "identity",
  "id": "service-atoms/identity/1password-api",
  "version": "1.0.0",
  "name": "1Password Connect Server API",
  "description": "1Password Connect Server REST API for programmatic secret retrieval from vaults. Used for injecting secrets into CI/CD and runtime environments.",
  "service_type": "api",
  "base_url": "https://{connect_host}/v1",
  "protocol": "https",
  "auth_schemes": ["bearer"],
  "tags": ["secrets", "vault", "credentials", "1password"],
  "status": "active"
}
